{
  "input_type": "VARIANCE_ANALYSIS",
  "analyses": ["VARIANCE_COMPONENTS", "POWER_ANALYSIS", "CONSISTENCY_CHECK"],
  "replicate_structure": [
    {"level": "BATCH", "n": 2, "group_reference": "BATCH-101", "batch_reference": "BATCH-101", "sample_reference": "S-101A"},
    {"level": "BATCH", "n": 2, "group_reference": "BATCH-102", "batch_reference": "BATCH-102", "sample_reference": "S-102A"},
    {"level": "BATCH", "n": 2, "group_reference": "BATCH-103", "batch_reference": "BATCH-103", "sample_reference": "S-103A"},
    {"level": "BATCH", "n": 2, "group_reference": "BATCH-201", "batch_reference": "BATCH-201", "sample_reference": "S-201A"},
    {"level": "BATCH", "n": 2, "group_reference": "BATCH-202", "batch_reference": "BATCH-202", "sample_reference": "S-202A"},
    {"level": "BATCH", "n": 2, "group_reference": "BATCH-203", "batch_reference": "BATCH-203", "sample_reference": "S-203A"},
    {"level": "BENCH", "n": 2, "group_reference": "RUN-A01", "batch_reference": "BATCH-101", "sample_reference": "S-101A"},
    {"level": "BENCH", "n": 2, "group_reference": "RUN-A03", "batch_reference": "BATCH-102", "sample_reference": "S-102A"},
    {"level": "BENCH", "n": 2, "group_reference": "RUN-A05", "batch_reference": "BATCH-103", "sample_reference": "S-103A"},
    {"level": "BENCH", "n": 2, "group_reference": "RUN-B01", "batch_reference": "BATCH-201", "sample_reference": "S-201A"},
    {"level": "BENCH", "n": 2, "group_reference": "RUN-B03", "batch_reference": "BATCH-202", "sample_reference": "S-202A"},
    {"level": "BENCH", "n": 2, "group_reference": "RUN-B05", "batch_reference": "BATCH-203", "sample_reference": "S-203A"},
    {"level": "MEASUREMENT", "n": 2, "group_reference": "RUN-A01", "batch_reference": "BATCH-101", "sample_reference": "S-101A"},
    {"level": "MEASUREMENT", "n": 2, "group_reference": "RUN-B01", "batch_reference": "BATCH-201", "sample_reference": "S-201A"}
  ],
  "observations": [
    {"observation_reference": "OBS-01", "level": "MEASUREMENT", "group_reference": "ARM-BLANK", "sample_id": "S-201A", "batch_id": "BATCH-201", "run_reference": "RUN-B01", "value": 4.20, "at": "2026-02-20T09:00:00Z", "event_occurred": true, "event_time": 4.20},
    {"observation_reference": "OBS-02", "level": "MEASUREMENT", "group_reference": "ARM-BLANK", "sample_id": "S-201A", "batch_id": "BATCH-201", "run_reference": "RUN-B01", "value": 4.30, "at": "2026-02-20T09:00:00Z", "event_occurred": true, "event_time": 4.30},
    {"observation_reference": "OBS-03", "level": "MEASUREMENT", "group_reference": "ARM-BLANK", "sample_id": "S-201B", "batch_id": "BATCH-201", "run_reference": "RUN-B02", "value": 4.30, "at": "2026-02-20T11:00:00Z", "event_occurred": true, "event_time": 4.30},
    {"observation_reference": "OBS-04", "level": "MEASUREMENT", "group_reference": "ARM-BLANK", "sample_id": "S-201B", "batch_id": "BATCH-201", "run_reference": "RUN-B02", "value": 4.40, "at": "2026-02-20T11:00:00Z", "event_occurred": true, "event_time": 4.40},
    {"observation_reference": "OBS-05", "level": "MEASUREMENT", "group_reference": "ARM-BLANK", "sample_id": "S-202A", "batch_id": "BATCH-202", "run_reference": "RUN-B03", "value": 4.40, "at": "2026-02-27T09:00:00Z", "event_occurred": true, "event_time": 4.40},
    {"observation_reference": "OBS-06", "level": "MEASUREMENT", "group_reference": "ARM-BLANK", "sample_id": "S-202A", "batch_id": "BATCH-202", "run_reference": "RUN-B03", "value": 4.50, "at": "2026-02-27T09:00:00Z", "event_occurred": true, "event_time": 4.50},
    {"observation_reference": "OBS-07", "level": "MEASUREMENT", "group_reference": "ARM-BLANK", "sample_id": "S-202B", "batch_id": "BATCH-202", "run_reference": "RUN-B04", "value": 4.50, "at": "2026-02-27T11:00:00Z", "event_occurred": true, "event_time": 4.50},
    {"observation_reference": "OBS-08", "level": "MEASUREMENT", "group_reference": "ARM-BLANK", "sample_id": "S-202B", "batch_id": "BATCH-202", "run_reference": "RUN-B04", "value": 4.60, "at": "2026-02-27T11:00:00Z", "event_occurred": true, "event_time": 4.60},
    {"observation_reference": "OBS-09", "level": "MEASUREMENT", "group_reference": "ARM-BLANK", "sample_id": "S-203A", "batch_id": "BATCH-203", "run_reference": "RUN-B05", "value": 4.60, "at": "2026-03-06T09:00:00Z", "event_occurred": true, "event_time": 4.60},
    {"observation_reference": "OBS-10", "level": "MEASUREMENT", "group_reference": "ARM-BLANK", "sample_id": "S-203A", "batch_id": "BATCH-203", "run_reference": "RUN-B05", "value": 4.70, "at": "2026-03-06T09:00:00Z", "event_occurred": true, "event_time": 4.70},
    {"observation_reference": "OBS-11", "level": "MEASUREMENT", "group_reference": "ARM-BLANK", "sample_id": "S-203B", "batch_id": "BATCH-203", "run_reference": "RUN-B06", "value": 4.70, "at": "2026-03-06T11:00:00Z", "event_occurred": true, "event_time": 4.70},
    {"observation_reference": "OBS-12", "level": "MEASUREMENT", "group_reference": "ARM-BLANK", "sample_id": "S-203B", "batch_id": "BATCH-203", "run_reference": "RUN-B06", "value": 4.80, "at": "2026-03-06T11:00:00Z", "event_occurred": true, "event_time": 4.80},
    {"observation_reference": "OBS-13", "level": "MEASUREMENT", "group_reference": "ARM-ADDITIVE", "sample_id": "S-101A", "batch_id": "BATCH-101", "run_reference": "RUN-A01", "value": 2.45, "at": "2026-02-20T09:00:00Z", "event_occurred": true, "event_time": 2.45},
    {"observation_reference": "OBS-14", "level": "MEASUREMENT", "group_reference": "ARM-ADDITIVE", "sample_id": "S-101B", "batch_id": "BATCH-101", "run_reference": "RUN-A02", "value": 2.55, "at": "2026-02-20T11:00:00Z", "event_occurred": true, "event_time": 2.55},
    {"observation_reference": "OBS-15", "level": "MEASUREMENT", "group_reference": "ARM-ADDITIVE", "sample_id": "S-102A", "batch_id": "BATCH-102", "run_reference": "RUN-A03", "value": 2.50, "at": "2026-02-27T09:00:00Z", "event_occurred": true, "event_time": 2.50},
    {"observation_reference": "OBS-16", "level": "MEASUREMENT", "group_reference": "ARM-ADDITIVE", "sample_id": "S-102B", "batch_id": "BATCH-102", "run_reference": "RUN-A04", "value": 2.60, "at": "2026-02-27T11:00:00Z", "event_occurred": true, "event_time": 2.60},
    {"observation_reference": "OBS-17", "level": "MEASUREMENT", "group_reference": "ARM-ADDITIVE", "sample_id": "S-103A", "batch_id": "BATCH-103", "run_reference": "RUN-A05", "value": 2.45, "at": "2026-03-06T09:00:00Z", "event_occurred": true, "event_time": 2.45},
    {"observation_reference": "OBS-18", "level": "MEASUREMENT", "group_reference": "ARM-ADDITIVE", "sample_id": "S-103B", "batch_id": "BATCH-103", "run_reference": "RUN-A06", "value": 2.55, "at": "2026-03-06T11:00:00Z", "event_occurred": true, "event_time": 2.55},
    {"observation_reference": "OBS-19", "level": "MEASUREMENT", "group_reference": "ARM-BLANK", "sample_id": "S-201C", "batch_id": "BATCH-201", "run_reference": "RUN-B07", "value": 10.00, "at": "2026-02-20T13:00:00Z", "event_occurred": false, "event_time": null},
    {"observation_reference": "OBS-20", "level": "MEASUREMENT", "group_reference": "ARM-BLANK", "sample_id": "S-204A", "batch_id": "BATCH-204", "run_reference": "RUN-B08", "value": 4.50, "at": "2026-03-12T10:00:00Z", "event_occurred": true, "event_time": 4.50}
  ],
  "censoring": [
    {"observation_reference": "OBS-19", "event_occurred": false, "event_time": null, "censoring_type": "RIGHT", "stop_reason": "RIGHT-censored at the 10 h protocol limit; no event observed, so the 10 h value is not an endpoint"},
    {"observation_reference": "OBS-01", "event_occurred": true, "event_time": 4.20, "censoring_type": "NONE", "stop_reason": "event observed inside the protocol window"}
  ],
  "intervention_events": [
    {"event_id": "IV-00", "description": "routine torque transducer zero check, protocol step, no setpoint change", "at": "2026-02-24T08:00:00Z", "confounds": false},
    {"event_id": "IV-01", "description": "bench re-adjusted and re-tested mid-campaign", "at": "2026-03-12T09:00:00Z", "until": "2026-03-13T18:00:00Z", "confounds": true}
  ],
  "comparison_arms": {
    "arm_a_group_reference": "ARM-ADDITIVE",
    "arm_b_group_reference": "ARM-BLANK"
  },
  "frozen_sigma_reference": "METHOD-CHAR-S1A-004",
  "frozen_sigma": 0.2,
  "control_band": 0.6,
  "preregistered_delta": 1.5,
  "k_required": 3,
  "alpha": 0.05,
  "target_power": 0.8,
  "resolution_n_values": [2, 3, 6, 12]
}
